{
  "id": "org:73hustlercrip",
  "name": "73 Hustler Crips",
  "lane": "california-crips-hustler",
  "metro": "Los Angeles",
  "description": "Eastside 73 Hustler Crips are a predominately African-American street gang located on 73rd Street between Avalon and Wadsworth.",
  "type": "street_gang",
  "nation_affiliation": "org:crips",
  "sources": [
    {
      "url": "https://www.streetgangs.com/crips/losangeles/73hustlercrip",
      "title": "73Hustlercrip — StreetGangs"
    }
  ],
  "colors": [
    "blue",
    "green"
  ],
  "founded_year": 1975,
  "founded_year_precision": "circa",
  "aliases": [
    "STHC / STHGC"
  ],
  "status": "active"
}
