{
  "id": "org:red-skin-kingz",
  "name": "Red Skin Kingz",
  "aliases": [
    "RSK"
  ],
  "type": "street_gang",
  "lane": "midwest",
  "founded_year": 2003,
  "founded_year_precision": "exact",
  "description": "Former Native American street gang founded in 2003 in Lukachukai, Arizona, operating on the Navajo Nation. Engaged in drug trafficking, carjacking, kidnapping, and murder. Characterized by law enforcement as immensely violent. Now defunct.",
  "status": "inactive",
  "sources": [
    {
      "url": "https://en.wikipedia.org/wiki/Red_Skin_Kingz",
      "title": "Red Skin Kingz — Wikipedia"
    }
  ],
  "colors": [
    "red"
  ],
  "metro": "United States",
  "disbanded_year": 2010
}
