{
  "id": "org:alley-tiny-criminals",
  "name": "Alley Tiny Criminals",
  "lane": "california-latino-other",
  "metro": "Los Angeles",
  "description": "The Alley Tiny Criminals (ATC) are a Latino street gang and tagging crew originating from the Exposition Park area of South Central Los Angeles, aligned with the Sureño (13) structure.",
  "type": "street_gang",
  "sources": [
    {
      "url": "https://www.streetgangs.com/hispanic/cityofla/eastside/atc",
      "title": "Alley Tiny Criminals — StreetGangs"
    }
  ],
  "founded_year": 1965,
  "founded_year_precision": "circa",
  "colors": [
    "blue"
  ],
  "status": "active",
  "aliases": [],
  "symbols": [
    "Atlanta Braves Apparel"
  ],
  "membership_estimate": 68
}
