{
  "id": "org:west-side-aztlan",
  "name": "West Side Aztlan",
  "lane": "california-latino-westside",
  "metro": "Los Angeles",
  "description": "California Varrio Aztlan (AZT) are a predominately Hispanic street gang in the Mid Wilshire area of Los Angeles, California.",
  "type": "street_gang",
  "sources": [
    {
      "url": "https://en.wikipedia.org/wiki/West_Side_Aztlan",
      "title": "West Side Aztlan — Wikipedia"
    }
  ],
  "founded_year": 1965,
  "founded_year_precision": "circa",
  "aliases": [
    "AZT"
  ],
  "colors": [
    "blue"
  ],
  "status": "active"
}
