{
  "id": "org:van-owen-street-locos",
  "name": "Van Owen Street Locos",
  "lane": "california-latino-sfv",
  "metro": "Los Angeles",
  "description": "A Latino Sure\u00f1o-affiliated street gang based near Van Owen Street in the San Fernando Valley, part of the network of SFV Hispanic gangs documented since the 1990s.",
  "type": "street_gang",
  "sources": [
    {
      "url": "https://www.streetgangs.com/hispanic/cityofla/sfvalley/vanowenstreet/",
      "title": "Van Owen Street Locos \u2014 StreetGangs"
    }
  ],
  "founded_year": 1960,
  "founded_year_precision": "decade",
  "colors": [
    "blue"
  ],
  "status": "active",
  "aliases": []
}