{
  "id": "org:graveyard-crips",
  "name": "Graveyard Crips",
  "type": "street_gang",
  "lane": "california-crips-other",
  "founded_year": 2009,
  "founded_year_precision": "exact",
  "description": "African-American Crip set based in the Pico neighborhood of Santa Monica, California, named for their proximity to Woodlawn Cemetery. Founded in the 1970s under the Gangster Crips umbrella, with long-running rivalries with Santa Monica 13 and Venice Shoreline Crips.",
  "sources": [
    {
      "url": "https://www.streetgangs.com/crips/santamonica/graveyard",
      "title": "Graveyard Crips — StreetGangs"
    },
    {
      "url": "https://unitedgangs.com/graveyard-crips",
      "title": "Graveyard Crips — UnitedGangs"
    }
  ],
  "metro": "Los Angeles",
  "colors": [
    "blue"
  ],
  "nation_affiliation": "org:crips",
  "status": "active",
  "aliases": [
    "Graveyard Gangster Crips",
    "GYC",
    "GYGC"
  ]
}
