{
  "id": "org:gardena-dragnet-gang",
  "name": "Gardena Dragnet Gang",
  "lane": "california-crips-inglewood",
  "metro": "Los Angeles",
  "description": "Gardena Dragnet Gang are a predominately African-American street gang located in Gardena, California, a suburban city South of Los Angeles.",
  "type": "street_gang",
  "nation_affiliation": "org:crips",
  "sources": [
    {
      "url": "https://www.streetgangs.com/crips/dragnet",
      "title": "Gardena Dragnet Gang — StreetGangs"
    }
  ],
  "colors": [
    "blue"
  ],
  "founded_year": 1974,
  "founded_year_precision": "circa",
  "aliases": [
    "Dragnets",
    "Notorious Dragnet"
  ],
  "status": "active"
}
