{
  "id": "org:hermandad-de-pistoleros-latinos",
  "name": "Hermandad De Pistoleros Latinos",
  "aliases": [
    "Brotherhood of Latin Gunmen",
    "Hermanos de Pistoleros Latinos",
    "HPL",
    "HPL 45s"
  ],
  "type": "prison_gang",
  "lane": "southeast-southwest",
  "founded_year": 1980,
  "founded_year_precision": "decade",
  "description": "Mexican American prison gang founded by Chino Avitia in the Texas Department of Criminal Justice (TDCJ) during the late 1980s. It operates in most Texas prisons and on the streets in many communities in Texas, particularly Laredo. HPL is also active in several cities in Mexico, and its largest contingent in that country is located in Nuevo Laredo. The gang is structured and is estimated to have 1,000 members. Members maintain close ties to several Mexican DTOs and are involved in trafficking cocaine and marijuana from Mexico into the United States for distribution.",
  "sources": [
    {
      "url": "https://en.wikipedia.org/wiki/Hermanos_de_Pistoleros_Latinos",
      "title": "Hermanos de Pistoleros Latinos — Wikipedia"
    }
  ],
  "metro": "United States",
  "colors": [
    "brown"
  ],
  "status": "active",
  "membership_estimate": 1000
}
