{
  "id": "org:westside-18th-street-west-adams",
  "name": "Westside 18th Street (West Adams)",
  "lane": "california-latino-westside",
  "metro": "Los Angeles",
  "description": "A clique of the 18th Street Gang operating in the West Adams neighborhood of Los Angeles. The 18th Street Gang is one of the largest transnational criminal organizations with origins in LA's Rampart area in the 1960s.",
  "type": "street_gang",
  "sources": [
    {
      "url": "https://www.streetgangs.com/hispanic/cityofla/southlaws/ws-18th-street-west-adams",
      "title": "Westside 18th Street (West Adams) — StreetGangs"
    }
  ],
  "founded_year": 1965,
  "founded_year_precision": "circa",
  "colors": [
    "blue",
    "black"
  ],
  "status": "active",
  "aliases": []
}
