{
  "id": "org:outlaw-gangsters",
  "name": "Outlaw Gangsters",
  "aliases": [],
  "type": "street_gang",
  "lane": "chicago-folk",
  "metro": "Chicago",
  "description": "The Outlaw Gangsters are a Folk Nation street gang based in Chicago. Listed by the Illinois State Police and Chicago Police Department as an active Folk Nation-affiliated gang.",
  "founded_year": 1980,
  "founded_year_precision": "decade",
  "colors": [],
  "nation_affiliation": "org:folk-nation",
  "status": "active",
  "sources": [
    {
      "url": "https://en.wikipedia.org/wiki/Gangs_in_Chicago",
      "title": "Gangs in Chicago - Wikipedia"
    }
  ]
}