{
  "id": "org:almighty-gaylords-nation",
  "name": "Almighty Gaylords Nation",
  "type": "street_gang",
  "lane": "chicago-folk",
  "metro": "Chicago",
  "description": "The Almighty Gaylords Nation is a European-American Chicago street gang founded in 1952 in the West Town neighborhood at Grand and Noble Street, originally composed mostly of Italians, Irish, and Greek Americans. By 1979 they ranked as the fourth most powerful gang in Chicago, noted as 'Chicago's largest white street gang,' with sets spanning the North, West, and South Sides at their peak. They are members of the People Nation alliance, with allies including the Latin Kings, Vice Lords, and Indiana Aryan Brotherhood. The gang declined in the 1990s as leaders were incarcerated; in 2011, nine suburban members were arrested for drug dealing and gun trafficking.",
  "founded_year": 1952,
  "aliases": [
    "Gaylords",
    "GLs"
  ],
  "sources": [
    {
      "url": "https://en.wikipedia.org/wiki/Chicago_Gaylords",
      "title": "Chicago Gaylords — Wikipedia"
    },
    {
      "url": "https://en.wikipedia.org/wiki/Popes_%28gang%29",
      "title": "Popes %28gang%29 — Wikipedia"
    },
    {
      "url": "https://en.wikipedia.org/wiki/Maniac_Latin_Disciples",
      "title": "Maniac Latin Disciples — Wikipedia"
    },
    {
      "url": "https://en.wikipedia.org/wiki/People_Nation",
      "title": "People Nation — Wikipedia"
    },
    {
      "url": "https://en.wikipedia.org/wiki/Simon_City_Royals",
      "title": "Simon City Royals — Wikipedia"
    },
    {
      "url": "https://en.wikipedia.org/wiki/Jousters",
      "title": "Jousters — Wikipedia"
    },
    {
      "url": "https://chicagoganghistory.com/gang/almighty-gaylords",
      "title": "Gaylords - Chicago Gang History"
    }
  ],
  "colors": [
    "black",
    "gray",
    "green",
    "brown"
  ],
  "founded_year_precision": "exact",
  "status": "active",
  "nation_affiliation": "org:folk-nation",
  "symbols": [
    "Skull",
    "Top Hat",
    "Cane",
    "Dice",
    "Whiskey Bottle",
    "Ku Klux Klansman",
    "Swastika",
    "Celtic Cross",
    "Embroidered G"
  ],
  "membership_estimate": 1500
}
