{
  "id": "org:wicker-park-warlords",
  "name": "Wicker Park Warlords",
  "aliases": [
    "La Familia Warlords",
    "Chicago Warlords",
    "Warlords"
  ],
  "type": "street_gang",
  "lane": "chicago-independent",
  "metro": "Chicago",
  "founded_year": 1964,
  "founded_year_precision": "exact",
  "description": "The Wicker Park Warlords were a Chicago street gang that originated in 1964 in the Wicker Park neighborhood, founded by a member named Frank who assembled a Latin Kings softball team under the Warlords name. They established their headquarters at Evergreen and Damen and later grew multiple sections including La Familia Warlords, Spaulding Warlords, Clemente Warlords, Bucktown Warlords, and Anderson Warlords. In 1969, the Warlords helped form the United Neighborhoods alliance alongside the Spanish Lords and Latin Kings to defend Puerto Rican communities against white greaser gangs. Their primary enemies were the Taylor Jousters, Chi-West, Gaylords, PVR/PVPs, and Vice Lords.",
  "colors": [
    "orange",
    "black"
  ],
  "nation_affiliation": null,
  "status": "active",
  "sources": [
    {
      "url": "https://stonegreasers.com/greaser/warlords.html",
      "title": "Chicago Warlords Gang - United Neighborhoods"
    },
    {
      "url": "https://chicagoganghistory.com/gangs/warlords-wicker-park-la-familia-warlords",
      "title": "Warlords Wicker Park, La Familia Warlords | Chicago Gang History"
    }
  ]
}
