{
  "id": "org:black-dragons",
  "name": "Black Dragons",
  "aliases": [
    "Haak1 Lung4"
  ],
  "type": "street_gang",
  "lane": "asian-gangs",
  "founded_year": 1984,
  "founded_year_precision": "circa",
  "description": "Chinese-American criminal organization and street gang formed in the early 1980s by ethnic Chinese immigrants from Vietnam in Lincoln Heights, Los Angeles. Operated in Los Angeles and the San Gabriel Valley, involved in both organized crime (extortion, prostitution, money laundering, narcotics, counterfeiting) and street-level crime (murder, robbery, home invasion). At its peak had over 100 core members. The gang was largely dismantled after a 2003 FBI sweep that arrested over 20 members; its three leaders were convicted and sentenced to more than 24 years in prison in 2005.",
  "sources": [
    {
      "url": "https://en.wikipedia.org/wiki/Black_Dragons_%28gang%29",
      "title": "Black Dragons (gang) — Wikipedia"
    },
    {
      "url": "https://unitedgangs.com/black-dragons-gang",
      "title": "Black Dragons Gang — UnitedGangs"
    },
    {
      "url": "https://www.latimes.com/archives/la-xpm-2005-jun-21-me-dragons21-story.html",
      "title": "Court May Have Slain Black Dragon — Los Angeles Times (2005)"
    },
    {
      "url": "https://en.wikipedia.org/wiki/Wah_Ching",
      "title": "Wah Ching — Wikipedia"
    }
  ],
  "metro": "Los Angeles",
  "colors": [
    "black"
  ],
  "status": "active",
  "membership_estimate": 100
}
