{
  "id": "org:enchanters",
  "name": "Enchanters",
  "aliases": [],
  "type": "street_gang",
  "lane": "historical-east",
  "metro": "New York",
  "founded_year": 1950,
  "founded_year_precision": "circa",
  "description": "The Enchanters were a 1950s New York City youth street gang with factions in East Harlem (Manhattan), Astoria (Queens), and Corona (Queens). The East Harlem chapter, centered on East 100th Street, was implicated in a murder in February 1955. The Astoria chapter battled the Parkside Gents, Hobo Lords, and Queensbridge Projects gangs. The Corona chapter, formed in the late 1950s, had sub-divisions including the Little, Baby, Big, and Lady Enchanters, and allied with the Chaplins against the Dukes in the 1961 Newtown High School fight.",
  "colors": [],
  "nation_affiliation": null,
  "status": "inactive",
  "sources": [
    {
      "url": "https://newyorkcitygangs.com/?page_id=2935",
      "title": "Eddie of the Enchanters Gang, 1955 | New York City Fighting Gangs"
    },
    {
      "url": "https://stonegreasers.com/greaser/new_york_gangs.html",
      "title": "New York Greasers, Gangs and Clubs From New York | Stone Greasers"
    },
    {
      "url": "https://newyorkcitygangs.com/?page_id=493",
      "title": "East Harlem Gangs in the 1950s | New York City Fighting Gangs"
    }
  ]
}
