{
  "id": "org:east-harlem-purple",
  "name": "East Harlem Purple Gang",
  "aliases": [
    "East Harlem Purple"
  ],
  "type": "street_gang",
  "lane": "new-york",
  "metro": "New York",
  "founded_year": 1970,
  "founded_year_precision": "decade",
  "description": "The East Harlem Purple Gang was a group of Italian-American hitmen and heroin dealers who dominated distribution in East Harlem and the Bronx during the late 1970s–early 1980s. Known for extreme violence including dismembering victims, they reportedly killed at least 17 people by December 1977. Surviving members were absorbed into the Lucchese crime family's 116th Street Crew.",
  "sources": [
    {
      "url": "https://en.wikipedia.org/wiki/east_harlem_purple_gang",
      "title": "east harlem purple gang — Wikipedia"
    },
    {
      "url": "https://en.wikipedia.org/wiki/116th_Street_Crew",
      "title": "116th Street Crew — Wikipedia"
    },
    {
      "url": "https://en.wikipedia.org/wiki/American_Mafia",
      "title": "American Mafia — Wikipedia"
    },
    {
      "url": "https://en.wikipedia.org/wiki/Mafia_estadounidense",
      "title": "Mafia estadounidense — Wikipedia"
    },
    {
      "url": "https://en.wikipedia.org/wiki/Bonanno_crime_family",
      "title": "Bonanno crime family — Wikipedia"
    },
    {
      "url": "https://en.wikipedia.org/wiki/Detroit_Partnership",
      "title": "Detroit Partnership — Wikipedia"
    },
    {
      "url": "https://en.wikipedia.org/wiki/East_Harlem_Purple_Gang",
      "title": "East Harlem Purple Gang - Wikipedia"
    }
  ],
  "colors": [
    "purple"
  ],
  "status": "active"
}
