{
  "id": "org:centinela-park-compton-crips",
  "name": "Centinela Park Compton Crips",
  "aliases": [
    "CPCC"
  ],
  "type": "street_gang",
  "lane": "california-crips-south-la",
  "metro": "Los Angeles",
  "founded_year": 1970,
  "description": "Willowbrook is a predominately African-American gang based just north of the city of Compton on the border in Willowbrook. They were formed around 1970 as the Carver Park Boys going back to the days when they functioned with the youth in the Nickerson Gardens.",
  "nation_affiliation": "org:crips",
  "sources": [
    {
      "url": "https://www.streetgangs.com/crips/compton/cpcc/",
      "title": "Centinela Park Compton Crips \u2014 StreetGangs"
    }
  ],
  "colors": [
    "blue"
  ],
  "founded_year_precision": "estimate",
  "status": "active"
}