{
  "id": "org:aristocrats",
  "name": "Aristocrats",
  "aliases": [
    "The Almighty Seminary and Barry Aristocrats",
    "Crats"
  ],
  "type": "street_gang",
  "lane": "chicago-independent",
  "metro": "Chicago",
  "founded_year": 1965,
  "founded_year_precision": "circa",
  "description": "The Aristocrats originated as the Black Saints, a street corner greaser gang based at Seminary and Barry in Chicago that had existed since the 1950s. They changed their name around 1965 due to confusion about being a Black club. They were a multiethnic gang, mostly white but including Puerto Ricans, Mexicans, Irish, and Italians, and were active in turf conflicts throughout the 1960s and 1970s.",
  "colors": [
    "black",
    "white",
    "red"
  ],
  "nation_affiliation": null,
  "status": "active",
  "sources": [
    {
      "url": "http://www.stonegreasers.com/greaser/aristocrats.html",
      "title": "www.stonegreasers.com"
    },
    {
      "url": "https://www.stonegreasers.com/greaser/aristocrats.html",
      "title": "Chicago Aristocrats Gang, Sherry-Berry Black Saints Gang – Stone Greasers"
    },
    {
      "url": "https://gaylords712.com/greaser/aristocrats_Simoncityroyals_deuces_rebels.html",
      "title": "Sherry Berry Black Saints - Aristocrats - Simon City Royals - Deuces"
    },
    {
      "url": "https://chicagoganghistory.com/hoods/lakeview",
      "title": "Lake View - North Side, Wrigleyville & Boystown | Chicago Gang History"
    }
  ],
  "symbols": [
    "Top Hat",
    "Cane",
    "Gloves",
    "Dice"
  ]
}
